{
  "$id": "https://tokenpilot.dev/schemas/usage-batch.schema.json",
  "$schema": "https://json-schema.org/draft/2020-12/schema",
  "type": "object",
  "properties": {
    "schema_version": {
      "$ref": "#/$defs/__schema0"
    },
    "batch_id": {
      "$ref": "#/$defs/__schema1"
    },
    "sent_at": {
      "$ref": "#/$defs/__schema2"
    },
    "events": {
      "$ref": "#/$defs/__schema3"
    }
  },
  "required": [
    "schema_version",
    "batch_id",
    "sent_at",
    "events"
  ],
  "additionalProperties": false,
  "title": "Usage Batch",
  "$defs": {
    "__schema0": {
      "type": "string",
      "const": "2.0"
    },
    "__schema1": {
      "type": "string",
      "pattern": "^[A-Za-z0-9][A-Za-z0-9._:@-]{0,255}$"
    },
    "__schema2": {
      "type": "string",
      "pattern": "^[0-9]{4}-[0-9]{2}-[0-9]{2}T[0-9]{2}:[0-9]{2}:[0-9]{2}(?:\\.[0-9]{1,9})?Z$"
    },
    "__schema3": {
      "minItems": 1,
      "maxItems": 1000,
      "type": "array",
      "items": {
        "$ref": "#/$defs/UsageEvent"
      }
    },
    "UsageEvent": {
      "type": "object",
      "properties": {
        "schema_version": {
          "$ref": "#/$defs/__schema4"
        },
        "event_id": {
          "$ref": "#/$defs/EventId"
        },
        "event_time": {
          "$ref": "#/$defs/__schema2"
        },
        "application_version": {
          "$ref": "#/$defs/__schema7"
        },
        "sdk_version": {
          "$ref": "#/$defs/__schema8"
        },
        "connector_version": {
          "$ref": "#/$defs/__schema9"
        },
        "config_version": {
          "$ref": "#/$defs/__schema10"
        },
        "user": {
          "$ref": "#/$defs/__schema11"
        },
        "event_properties": {
          "$ref": "#/$defs/__schema12"
        },
        "user_properties": {
          "$ref": "#/$defs/__schema17"
        },
        "source": {
          "$ref": "#/$defs/__schema18"
        },
        "request": {
          "$ref": "#/$defs/__schema19"
        },
        "model": {
          "$ref": "#/$defs/__schema20"
        },
        "route": {
          "$ref": "#/$defs/__schema22"
        },
        "analytics_dimensions": {
          "$ref": "#/$defs/AnalyticsDimensions"
        },
        "result": {
          "$ref": "#/$defs/__schema26"
        },
        "source_cost": {
          "$ref": "#/$defs/__schema27"
        },
        "privacy": {
          "$ref": "#/$defs/__schema28"
        },
        "usage": {
          "$ref": "#/$defs/__schema29"
        }
      },
      "required": [
        "schema_version",
        "event_id",
        "event_time",
        "user",
        "source",
        "request",
        "model",
        "route",
        "analytics_dimensions",
        "result",
        "source_cost",
        "privacy",
        "usage"
      ],
      "additionalProperties": false,
      "title": "Usage Event",
      "description": "A privacy-preserving raw usage event with mutually exclusive usage buckets."
    },
    "__schema4": {
      "type": "string",
      "const": "2.0"
    },
    "EventId": {
      "anyOf": [
        {
          "$ref": "#/$defs/__schema5"
        },
        {
          "$ref": "#/$defs/__schema6"
        }
      ],
      "title": "Event ID",
      "description": "A globally idempotent ULID or UUIDv7 event identifier."
    },
    "__schema5": {
      "type": "string",
      "pattern": "^[0-9A-HJKMNP-TV-Z]{26}$"
    },
    "__schema6": {
      "type": "string",
      "pattern": "^[0-9A-Fa-f]{8}-[0-9A-Fa-f]{4}-7[0-9A-Fa-f]{3}-[89ABab][0-9A-Fa-f]{3}-[0-9A-Fa-f]{12}$"
    },
    "__schema7": {
      "type": "string",
      "minLength": 1,
      "maxLength": 64
    },
    "__schema8": {
      "type": "string",
      "minLength": 1,
      "maxLength": 64
    },
    "__schema9": {
      "type": "string",
      "minLength": 1,
      "maxLength": 64
    },
    "__schema10": {
      "type": "string",
      "minLength": 1,
      "maxLength": 64
    },
    "__schema11": {
      "type": "object",
      "properties": {
        "user_id": {
          "type": "string",
          "minLength": 1,
          "maxLength": 256
        },
        "display_user": {
          "anyOf": [
            {
              "type": "string",
              "minLength": 1,
              "maxLength": 256
            },
            {
              "type": "null"
            }
          ]
        }
      },
      "required": [
        "user_id"
      ],
      "additionalProperties": false
    },
    "__schema12": {
      "$ref": "#/$defs/__schema13"
    },
    "__schema13": {
      "type": "object",
      "propertyNames": {
        "$ref": "#/$defs/__schema14"
      },
      "additionalProperties": {
        "$ref": "#/$defs/__schema15"
      }
    },
    "__schema14": {
      "type": "string",
      "maxLength": 128,
      "pattern": "^[a-z][a-z0-9._-]{0,127}$"
    },
    "__schema15": {
      "anyOf": [
        {
          "type": "string",
          "minLength": 1,
          "maxLength": 2048
        },
        {
          "type": "integer",
          "minimum": -9007199254740991,
          "maximum": 9007199254740991
        },
        {
          "type": "boolean"
        },
        {
          "maxItems": 32,
          "type": "array",
          "items": {
            "$ref": "#/$defs/__schema16"
          }
        }
      ]
    },
    "__schema16": {
      "type": "string",
      "minLength": 1,
      "maxLength": 256
    },
    "__schema17": {
      "$ref": "#/$defs/__schema13"
    },
    "__schema18": {
      "type": "object",
      "properties": {
        "type": {
          "$ref": "#/$defs/UsageSourceType"
        },
        "name": {
          "type": "string",
          "minLength": 1,
          "maxLength": 120
        },
        "version": {
          "type": "string",
          "minLength": 1,
          "maxLength": 64
        },
        "instance_id": {
          "type": "string",
          "minLength": 1,
          "maxLength": 256
        }
      },
      "required": [
        "type",
        "name",
        "version",
        "instance_id"
      ],
      "additionalProperties": false
    },
    "UsageSourceType": {
      "type": "string",
      "enum": [
        "gateway",
        "sdk",
        "import",
        "reconciler",
        "unknown"
      ]
    },
    "__schema19": {
      "type": "object",
      "properties": {
        "request_id": {
          "$ref": "#/$defs/__schema1"
        },
        "attempt_id": {
          "$ref": "#/$defs/__schema1"
        },
        "operation_id": {
          "anyOf": [
            {
              "$ref": "#/$defs/__schema1"
            },
            {
              "type": "null"
            }
          ]
        },
        "parent_request_id": {
          "anyOf": [
            {
              "$ref": "#/$defs/__schema1"
            },
            {
              "type": "null"
            }
          ]
        },
        "session_id": {
          "anyOf": [
            {
              "$ref": "#/$defs/__schema1"
            },
            {
              "type": "null"
            }
          ]
        },
        "conversation_id": {
          "anyOf": [
            {
              "$ref": "#/$defs/__schema1"
            },
            {
              "type": "null"
            }
          ]
        },
        "trace_id": {
          "anyOf": [
            {
              "$ref": "#/$defs/__schema1"
            },
            {
              "type": "null"
            }
          ]
        },
        "reservation_id": {
          "anyOf": [
            {
              "$ref": "#/$defs/__schema1"
            },
            {
              "type": "null"
            }
          ]
        }
      },
      "required": [
        "request_id",
        "attempt_id",
        "operation_id",
        "parent_request_id",
        "session_id",
        "conversation_id",
        "trace_id"
      ],
      "additionalProperties": false
    },
    "__schema20": {
      "type": "object",
      "properties": {
        "virtual_model": {
          "anyOf": [
            {
              "type": "string",
              "maxLength": 120,
              "pattern": "^[a-z][a-z0-9]*(?:[._-][a-z0-9]+)*$"
            },
            {
              "type": "null"
            }
          ]
        },
        "model_id": {
          "anyOf": [
            {
              "$ref": "#/$defs/__schema1"
            },
            {
              "type": "null"
            }
          ]
        },
        "model_tag": {
          "type": "string",
          "minLength": 1,
          "maxLength": 256
        },
        "provider": {
          "$ref": "#/$defs/__schema21"
        }
      },
      "required": [
        "model_tag"
      ],
      "additionalProperties": false
    },
    "__schema21": {
      "anyOf": [
        {
          "type": "string",
          "minLength": 1,
          "maxLength": 256
        },
        {
          "type": "null"
        }
      ]
    },
    "__schema22": {
      "anyOf": [
        {
          "type": "object",
          "properties": {
            "configuration_version": {
              "$ref": "#/$defs/__schema21"
            },
            "rule": {
              "$ref": "#/$defs/__schema21"
            },
            "reason": {
              "$ref": "#/$defs/__schema21"
            },
            "tags": {
              "maxItems": 16,
              "type": "array",
              "items": {
                "$ref": "#/$defs/__schema23"
              }
            },
            "fallback_from": {
              "$ref": "#/$defs/__schema21"
            },
            "is_final_success_attempt": {
              "type": "boolean"
            },
            "is_user_visible_operation": {
              "type": "boolean"
            }
          },
          "required": [
            "configuration_version",
            "rule",
            "reason",
            "tags",
            "fallback_from",
            "is_final_success_attempt"
          ],
          "additionalProperties": false
        },
        {
          "type": "null"
        }
      ]
    },
    "__schema23": {
      "type": "string",
      "maxLength": 200,
      "pattern": "^cp:[a-z0-9][a-z0-9._-]*(?::[a-z0-9][a-z0-9._-]*)+$"
    },
    "AnalyticsDimensions": {
      "type": "object",
      "propertyNames": {
        "pattern": "^[a-z][a-z0-9_]{0,63}$"
      },
      "additionalProperties": {
        "$ref": "#/$defs/__schema25"
      },
      "title": "Analytics Dimensions",
      "description": "Custom dimensions used only for usage analysis and reports.",
      "maxProperties": 32
    },
    "__schema24": {
      "type": "string",
      "pattern": "^[a-z][a-z0-9_]{0,63}$"
    },
    "__schema25": {
      "anyOf": [
        {
          "type": "string",
          "maxLength": 256
        },
        {
          "type": "integer",
          "minimum": -9007199254740991,
          "maximum": 9007199254740991
        },
        {
          "type": "boolean"
        }
      ]
    },
    "__schema26": {
      "type": "object",
      "properties": {
        "status": {
          "$ref": "#/$defs/ResultStatus"
        },
        "http_status": {
          "anyOf": [
            {
              "type": "integer",
              "minimum": 100,
              "maximum": 599
            },
            {
              "type": "null"
            }
          ]
        },
        "latency_ms": {
          "anyOf": [
            {
              "type": "integer",
              "minimum": 0,
              "maximum": 9007199254740991
            },
            {
              "type": "null"
            }
          ]
        },
        "error_class": {
          "$ref": "#/$defs/__schema21"
        }
      },
      "required": [
        "status",
        "http_status",
        "latency_ms",
        "error_class"
      ],
      "additionalProperties": false
    },
    "ResultStatus": {
      "type": "string",
      "enum": [
        "success",
        "failure",
        "cancelled",
        "timeout",
        "unknown"
      ]
    },
    "__schema27": {
      "anyOf": [
        {
          "type": "object",
          "properties": {
            "amount": {
              "$ref": "#/$defs/Decimal38Scale18"
            },
            "currency": {
              "type": "string",
              "pattern": "^[A-Z]{3}$"
            },
            "is_estimated": {
              "type": "boolean"
            }
          },
          "required": [
            "amount",
            "currency",
            "is_estimated"
          ],
          "additionalProperties": false
        },
        {
          "type": "null"
        }
      ]
    },
    "Decimal38Scale18": {
      "type": "string",
      "pattern": "^(?:0|[1-9][0-9]{0,19})(?:\\.[0-9]{1,18})?$"
    },
    "__schema28": {
      "type": "object",
      "properties": {
        "contains_prompt": {
          "type": "boolean",
          "const": false
        },
        "contains_response": {
          "type": "boolean",
          "const": false
        }
      },
      "required": [
        "contains_prompt",
        "contains_response"
      ],
      "additionalProperties": false
    },
    "__schema29": {
      "type": "object",
      "properties": {
        "uncached_input_tokens": {
          "$ref": "#/$defs/__schema30"
        },
        "cache_read_input_tokens": {
          "$ref": "#/$defs/__schema31"
        },
        "cache_write_input_tokens": {
          "$ref": "#/$defs/__schema32"
        },
        "output_tokens": {
          "$ref": "#/$defs/__schema33"
        },
        "reasoning_output_tokens": {
          "$ref": "#/$defs/__schema34"
        },
        "input_images": {
          "$ref": "#/$defs/__schema35"
        },
        "output_images": {
          "$ref": "#/$defs/__schema36"
        },
        "input_audio_seconds": {
          "$ref": "#/$defs/__schema37"
        },
        "output_audio_seconds": {
          "$ref": "#/$defs/__schema38"
        },
        "input_video_seconds": {
          "$ref": "#/$defs/__schema39"
        },
        "output_video_seconds": {
          "$ref": "#/$defs/__schema40"
        },
        "embedding_tokens": {
          "$ref": "#/$defs/__schema41"
        },
        "request_count": {
          "$ref": "#/$defs/__schema42"
        },
        "custom_units": {
          "$ref": "#/$defs/__schema43"
        }
      },
      "additionalProperties": false
    },
    "__schema30": {
      "$ref": "#/$defs/Decimal38Scale9"
    },
    "Decimal38Scale9": {
      "type": "string",
      "pattern": "^(?:0|[1-9][0-9]{0,28})(?:\\.[0-9]{1,9})?$"
    },
    "__schema31": {
      "$ref": "#/$defs/Decimal38Scale9"
    },
    "__schema32": {
      "$ref": "#/$defs/Decimal38Scale9"
    },
    "__schema33": {
      "$ref": "#/$defs/Decimal38Scale9"
    },
    "__schema34": {
      "$ref": "#/$defs/Decimal38Scale9"
    },
    "__schema35": {
      "$ref": "#/$defs/Decimal38Scale9"
    },
    "__schema36": {
      "$ref": "#/$defs/Decimal38Scale9"
    },
    "__schema37": {
      "$ref": "#/$defs/Decimal38Scale9"
    },
    "__schema38": {
      "$ref": "#/$defs/Decimal38Scale9"
    },
    "__schema39": {
      "$ref": "#/$defs/Decimal38Scale9"
    },
    "__schema40": {
      "$ref": "#/$defs/Decimal38Scale9"
    },
    "__schema41": {
      "$ref": "#/$defs/Decimal38Scale9"
    },
    "__schema42": {
      "$ref": "#/$defs/Decimal38Scale9"
    },
    "__schema43": {
      "maxItems": 32,
      "type": "array",
      "items": {
        "$ref": "#/$defs/__schema44"
      }
    },
    "__schema44": {
      "type": "object",
      "properties": {
        "unit_key": {
          "$ref": "#/$defs/__schema45"
        },
        "quantity": {
          "$ref": "#/$defs/Decimal38Scale9"
        },
        "unit": {
          "$ref": "#/$defs/__schema45"
        },
        "source_path": {
          "type": "string",
          "minLength": 1,
          "maxLength": 256,
          "pattern": "^(?:[A-Za-z0-9_.$-]|\\u005b|\\u005d)+$"
        },
        "is_estimated": {
          "type": "boolean"
        }
      },
      "required": [
        "unit_key",
        "quantity",
        "unit",
        "source_path",
        "is_estimated"
      ],
      "additionalProperties": false
    },
    "__schema45": {
      "type": "string",
      "pattern": "^[a-z][a-z0-9._-]{0,127}$"
    }
  }
}
